{
  "id": 10,
  "title": "Sessione 10",
  "videoId": "83KGFc-a-Ac",
  "chapters": [
    {
      "id": "inganno",
      "title": "L’inganno di Elis",
      "videoId": "edwlYjmojPs",
      "blocks": [
        {
          "type": "paragraph",
          "text": "Le acque stagnanti delle terme restituivano soltanto il suono dei passi del gruppo, un lento ciak… ciak… che rompeva il silenzio soffocante dei corridoi sommersi. Fu Elis, poco più avanti degli altri, a notare per primo la figura immobile nell’ombra."
        },
        {
          "type": "paragraph",
          "text": "Con la mente tesa come una corda d’arco, il tiefling comunicò silenziosamente ai compagni il pericolo imminente. Aelar bloccò immediatamente Nathan e il resto del gruppo, ponendosi davanti a loro come uno scudo vivente. Nessuno avanzò di un passo."
        },
        {
          "type": "paragraph",
          "text": "La figura, fino a quel momento voltata di spalle, inclinò appena il capo di lato, come una bestia che avesse colto il rumore della preda nell’oscurità."
        },
        {
          "type": "quote",
          "text": "Capo… abbiamo respinto degli intrusi."
        },
        {
          "type": "paragraph",
          "text": "Elis uscì allo scoperto, sostenendo la propria copertura con la sicurezza e il sangue freddo che solo lui sapeva esibire. Ma quando la luce tremolante della candela consumata illuminò meglio la stanza, la verità si rivelò in tutta la sua brutalità."
        },
        {
          "type": "paragraph",
          "text": "Su una breve rampa di gradini, fuori dalla zona allagata, stavano due figure: una donna robusta, avvolta in stracci rossi sopra un’armatura leggera, marchiata dal simbolo della mano; accanto a lei, un uomo imponente, alto oltre due metri, rivestito di armatura nera e con un elmo cilindrico. Nella sua mano brillava una spada ancora macchiata di sangue fresco."
        },
        {
          "type": "paragraph",
          "text": "Dietro di loro, quasi crocifisso al muro, un uomo nudo e martoriato era sospeso tramite catene ai polsi. Il suo corpo era un mosaico di tagli e ferite, ma il lieve oscillare della testa rivelava che fosse ancora vivo."
        },
        {
          "type": "paragraph",
          "text": "Elis avanzò, simulando fatica e urgenza, tentando di spingere i cultisti a ritirarsi o prepararsi contro altri presunti intrusi. Intanto, mentalmente, diede ai compagni il segnale:"
        },
        {
          "type": "quote",
          "text": "Cinque secondi e si va in scena. Inizio io."
        },
        {
          "type": "paragraph",
          "text": "La donna si avvicinò lentamente, la mazza ferrata stretta nella mano, fino a portarsi a pochi passi dal tiefling."
        },
        {
          "type": "paragraph",
          "text": "Fu allora che Elis affondò la mano sotto il mantello, fece apparire il pugnale e tentò di conficcarlo nello stomaco della cultista con un colpo rapido e letale."
        },
        {
          "type": "paragraph",
          "text": "Ma qualcosa non andò come previsto."
        },
        {
          "type": "paragraph",
          "text": "La donna non era sorpresa."
        },
        {
          "type": "paragraph",
          "text": "Il tempo sembrò spezzarsi."
        },
        {
          "type": "paragraph",
          "text": "Il combattimento ebbe inizio."
        }
      ]
    },
    {
      "id": "scontro",
      "title": "Lo scontro all’ultimo sangue",
      "videoId": "b3QxpvT6rVU",
      "blocks": [
        {
          "type": "paragraph",
          "text": "L’inganno di Elis si spezzò in un istante."
        },
        {
          "type": "paragraph",
          "text": "La cultista della Mano reagì con la rapidità di chi aveva già intuito il tradimento. La sua mazza fendette l’aria, mentre nello stesso momento Clayton si lanciò in avanti con un’audacia quasi incosciente, brandendo il pugnale balita ricevuto in dono."
        },
        {
          "type": "paragraph",
          "text": "Nathan avanzò subito dopo, invocando il potere divino. Una arma spirituale prese forma davanti al cavaliere in armatura nera: una mazza spettrale, luminosa, sospesa nell’aria come il giudizio degli dèi."
        },
        {
          "type": "paragraph",
          "text": "Aelar, muovendosi tra i compagni per trovare un varco visivo, puntò lo sguardo sulla donna armata. I suoi occhi si fecero sottili, serpiformi, e la voce si caricò di una forza innaturale."
        },
        {
          "type": "quote",
          "text": "Lascia la tua arma. E non osare attaccarmi."
        },
        {
          "type": "paragraph",
          "text": "La volontà della cultista vacillò. Per un attimo i suoi occhi si velarono, e la mazza le sfuggì di mano, cadendo con un tonfo metallico nell’acqua bassa ai piedi di Elis."
        },
        {
          "type": "paragraph",
          "text": "Ma il vero orrore si trovava accanto a lei."
        },
        {
          "type": "paragraph",
          "text": "Il Console di Ferro di Bane sollevò appena gli avambracci corazzati, e con un gesto secco due spade volanti si materializzarono accanto a lui, sospese nell’aria come estensioni della sua volontà. Armi animate, più grandi e più brutali di qualsiasi lama comune."
        },
        {
          "type": "paragraph",
          "text": "Lo scontro esplose in tutta la sua violenza."
        },
        {
          "type": "paragraph",
          "text": "Elis colpì la cultista con precisione letale, aprendo ferite profonde. Nathan e Kyran la pressarono senza tregua, mentre Aelar caricava il suo arco con il Crimson Rite, lasciando che il sangue alimentasse la potenza dei suoi colpi."
        },
        {
          "type": "paragraph",
          "text": "Fu però Aelar a spezzare definitivamente l’equilibrio della battaglia."
        },
        {
          "type": "paragraph",
          "text": "Raccogliendo energia tra entrambe le mani, intrecciò la magia in due flussi distinti e scagliò un doppio Guiding Bolt. La luce sacra esplose nella stanza come un lampo accecante."
        },
        {
          "type": "paragraph",
          "text": "Il primo raggio investì in pieno la cultista della Mano."
        },
        {
          "type": "paragraph",
          "text": "La sua testa esplose in una nube di sangue, ossa e luce."
        },
        {
          "type": "paragraph",
          "text": "Il corpo crollò pesantemente sui gradini, senza vita."
        },
        {
          "type": "paragraph",
          "text": "Con la morte della donna, la pressione magica del comando lanciato su Elis si dissolse all’istante."
        },
        {
          "type": "paragraph",
          "text": "Il combattimento, però, non era ancora terminato."
        },
        {
          "type": "paragraph",
          "text": "Il Console di Ferro avanzò come una macchina da guerra, mentre le sue spade fluttuanti fendettero l’aria tentando di colpire Nathan e Kyran. Nonostante la brutalità dell’assalto, il gruppo riuscì a reggere."
        },
        {
          "type": "paragraph",
          "text": "Aelar trovò finalmente un varco e scoccò una freccia intrisa del rito di sangue, che si conficcò nelle giunture dell’armatura del gigante."
        },
        {
          "type": "paragraph",
          "text": "Fu Kyran a chiudere lo scontro."
        },
        {
          "type": "paragraph",
          "text": "Con l’arma spirituale ancora sospesa al suo fianco, si avvicinò fino a trovarsi faccia a faccia con il cavaliere nero. Trovò un’apertura tra le placche e vi affondò il colpo."
        },
        {
          "type": "paragraph",
          "text": "Per un istante tutto tacque."
        },
        {
          "type": "paragraph",
          "text": "Poi l’armatura del Console iniziò a brillare."
        },
        {
          "type": "paragraph",
          "text": "Una luce sinistra filtrò dalle fessure dell’elmo."
        },
        {
          "type": "paragraph",
          "text": "E il suo corpo esplose."
        },
        {
          "type": "paragraph",
          "text": "Non fu l’onda d’urto a ferire maggiormente il gruppo, ma le schegge di metallo incandescente, proiettate in ogni direzione come una tempesta di lame."
        },
        {
          "type": "paragraph",
          "text": "Nathan fu investito di striscio. Kyran, invece, subì in pieno la detonazione."
        },
        {
          "type": "paragraph",
          "text": "Quando il fragore cessò, del cavaliere non restava che metallo sparso, sangue e silenzio."
        },
        {
          "type": "paragraph",
          "text": "La stanza era finalmente loro."
        }
      ]
    },
    {
      "id": "superstite",
      "title": "Un inaspettato superstite",
      "videoId": "mJbKOxo0tCI",
      "blocks": [
        {
          "type": "paragraph",
          "text": "Il fragore dell’esplosione si dissolse lentamente tra le pareti umide delle terme sotterranee."
        },
        {
          "type": "paragraph",
          "text": "Le schegge di metallo dell’armatura del Console di Ferro terminarono la loro corsa nell’acqua stagnante e nei muri di pietra. Aelar si mosse immediatamente, portandosi davanti al prigioniero per proteggerlo con il proprio corpo da eventuali detriti residui."
        },
        {
          "type": "paragraph",
          "text": "Ciò che restava dei due cultisti era sparso per la stanza in frammenti raccapriccianti: un pezzo d’armatura da una parte, lembi di carne dall’altra, persino un occhio galleggiante nell’acqua sporca."
        },
        {
          "type": "paragraph",
          "text": "Ma l’uomo incatenato era ancora vivo."
        },
        {
          "type": "paragraph",
          "text": "Appeso al muro con i polsi serrati dalle catene, il capo riverso in avanti e il corpo coperto di tagli, sembrava aver resistito per puro istinto di sopravvivenza."
        },
        {